{
  "description": "Rounds (Format 11.1): turn counts player messages on the path, so a group chat counts like a one-on-one",
  "bundle": {
    "kind": "bundle",
    "characters": [
      {
        "id": "a",
        "name": "Ann",
        "description": "Ann."
      },
      {
        "id": "b",
        "name": "Bea",
        "description": "Bea."
      }
    ],
    "scenarios": [
      {
        "id": "s",
        "cast": [
          {},
          {
            "character": "a"
          },
          {
            "character": "b"
          }
        ]
      }
    ]
  },
  "session": {
    "header": {
      "kind": "session",
      "scenario": "s",
      "characters": [
        {
          "id": "p",
          "name": "Pat",
          "description": "Pat."
        }
      ],
      "players": [
        "p"
      ]
    },
    "messages": [
      {
        "id": "1",
        "from": "player",
        "content": [
          {
            "speaker": "p",
            "text": "Hi both."
          }
        ]
      },
      {
        "id": "2",
        "parent": "1",
        "from": "model",
        "char": "a",
        "content": [
          {
            "speaker": "a",
            "text": "Hi."
          }
        ]
      },
      {
        "id": "3",
        "parent": "2",
        "from": "model",
        "char": "b",
        "content": [
          {
            "speaker": "b",
            "text": "Hello."
          }
        ]
      },
      {
        "id": "4",
        "parent": "3",
        "from": "player",
        "content": [
          {
            "speaker": "p",
            "text": "A day later."
          }
        ]
      }
    ]
  },
  "tests": [
    {
      "type": "cel",
      "name": "a player message counts itself",
      "at": "1",
      "expr": "turn == 1",
      "expect": true
    },
    {
      "type": "cel",
      "name": "two model replies in one round",
      "at": "3",
      "expr": "turn == 1",
      "expect": true
    },
    {
      "type": "cel",
      "at": "4",
      "expr": "turn == 2",
      "expect": true
    },
    {
      "type": "check",
      "expect": {
        "codes": []
      }
    }
  ]
}
